{
  "schema_version": 1,
  "evidence_kind": "blinded-forward-aggregate",
  "evaluated_at": "2026-07-27T10:16:50.000Z",
  "fixture": "synthetic/sample-cleanup",
  "candidate_skill_fingerprint": "ae837de374bb76e49899349107ad84128d3e32e843278042797521782b8bb444",
  "raw_outputs_published": false,
  "forward_evaluation": {
    "same_model_and_tools": true,
    "expected_findings_hidden": true,
    "required_behaviors": [
      {
        "id": "cleanup-defect",
        "baseline": true,
        "candidate": true
      },
      {
        "id": "publication-defect",
        "baseline": true,
        "candidate": true
      },
      {
        "id": "preference-does-not-justify-change",
        "baseline": true,
        "candidate": true
      },
      {
        "id": "stable-feedback-and-optimization-ids",
        "baseline": true,
        "candidate": true
      },
      {
        "id": "proposal-remains-deferred-before-user-decision",
        "baseline": true,
        "candidate": true
      },
      {
        "id": "analysis-does-not-modify-files",
        "baseline": true,
        "candidate": true
      }
    ],
    "baseline_passed_behaviors": 6,
    "candidate_passed_behaviors": 6,
    "candidate_regressions": 0,
    "false_positive_optimizations": 0,
    "passed": true
  },
  "platform_validation": {
    "installer": {
      "name": "skills",
      "version": "1.5.20",
      "scope": "isolated-project-copy"
    },
    "platforms": [
      {
        "id": "codex",
        "version": "codex-cli 0.139.0",
        "explicit_trigger": true,
        "target_and_reference_read": true,
        "positive_analysis": true,
        "negative_non_trigger": true,
        "stable_ids": true,
        "decision_boundary": true,
        "files_modified": false,
        "passed": true
      },
      {
        "id": "claude-code",
        "version": "2.1.220",
        "explicit_trigger": true,
        "target_and_reference_read": true,
        "positive_analysis": true,
        "negative_non_trigger": true,
        "stable_ids": true,
        "decision_boundary": true,
        "files_modified": false,
        "passed": true
      }
    ],
    "passed": true
  },
  "limits": [
    "The published evidence is an aggregate over a synthetic Skill and redacted evidence.",
    "The stable synthetic forward fixture is published at evals/cases/sample-cleanup-forward.json.",
    "Raw model output and temporary installation paths are not published.",
    "Platform validation covers installation, explicit triggering, negative non-triggering, and analysis-only behavior.",
    "The v0.1.0 baseline and v1.0.0 candidate were re-run with the same Codex model and read-only tools.",
    "The exact-Release local-update behavior is tracked by a separate aggregate.",
    "The live GitHub mutation lifecycle is tracked by a separate release gate."
  ]
}
